modern-languages-turkish,111,First-Semester Turkish,b'drills and written exercises.'
modern-languages-turkish,112,Second-Semester Turkish,"b'ment of aural and written comprehension, as well as writing and speaking abilities.'"
modern-languages-turkish,211,Third-Semester Turkish,"b'gh textbooks, authentic readings including literary works, internet-based exercises, and the use of Turkish audio and visual materials.'"
modern-languages-turkish,212,Fourth-Semester Turkish,"b'vels of  proficiency in reading, writing, listening, and speaking This course fulfills a  single unit in the following BU Hub area: Global Citizenship and Intercultural  Literacy.'"
modern-languages-turkish,491,Directed Study: Turkish,b''
modern-languages-turkish,492,Directed Study: Turkish,b''
