SSI,SOC-II,410,b'Archaeological Research Design and Materials Analysis',"b'This laboratory-driven course engages students in independent research design  and the hands-on analysis of archaeological materials. The course provides a  foundation in the integration of theory, research design, and analytical  methods through laboratory sessions where students work with archaeological  materials. This course fulfills a single unit in each of the following BU Hub  areas: Social Inquiry II, Critical Thinking, Teamwork/Collaboration.'"
SSI,SOC-II,506,b'Regional Archaeology and Geographical Information Systems (GIS)',"b'Use of advanced computer (GIS) techniques to address regional archaeological problems.This applied course examines digital encoding and manipulation of archaeological and environmental data, and methods for testing hypotheses, analyzing, and modeling the archaeological record.'"
SSI,SOC-II,518,b'Zooarchaeology',"b'Introduction to the study of archaeological animal bones. Provides theoretical   background and methodological skills necessary for interpreting past human-  animal interactions, subsistence, and paleoecology. Laboratory sections focus   on skeletal identification. This course fulfills a single unit in each of the   following BU Hub areas: Social Inquiry II, Quantitative Reasoning I.'"
SSI,SOC-II,322,b'Roman History',"b'Introduction to the political, social, and economic history of Rome from the  foundation of the city through the fall of the western empire. Cannot be taken  for credit in addition to CAS CL 222. Carries humanities divisional credit in  CAS. This course fulfills a single unit in each of the following BU Hub areas:  Historical Consciousness, Social Inquiry II, Critical Thinking.'"
SSI,SOC-II,230,b'Crime and Justice',"b'This course examines sociological research on crime, the social context of  violence, and  criminal justice policy in the United States. This course fulfills a single unit in each of the  following BU Hub areas: Social Inquiry II, Research and Information Literacy.'"
SSI,SOC-II,472,b'Music Perception and Cognition',"b'Covers selected topics in empirical research on music perception and cognition. These may include the cognitive processing of melody, harmony, rhythm, and timbre, the connection of music to emotion, computational study of musical corpora, the quantitative study of music performance, and the connection of music to other areas of human intelligence. Students learn to evaluate research articles, apply statistical models to musical and behavioral data, and propose their own studies. This course fulfills a single unit in each of the following BU Hub areas: Social Inquiry II, Quantitative Reasoning II, Research and Information Literacy.'"
SSI,SOC-II,102,"b'Modernization: Politics, Economics, and Culture'","b""CGS SS 102 -- Modernization: Politics, Economics, and Culture This course  examines the process of modernization in the West. The historical phenomena  of industrialization, the rise of liberal democracy, nationalism,  imperialism, and globalization -- all associated with modernization as it  took place in Europe in the 19th and 20th centuries -- are examined both in  their historical context and through the lens of theories of social change.  Through an examination of historical case studies, students will evaluate  the impact of these phenomena on the life, institutions, and ways of  thinking in the West. Students will also consider the historical legacy of  the West's modernization for contemporary global issues such as terrorism  and the challenges of development in non-Western societies.  One lecture,  two discussions, and one additional contact hour as assigned. This course  fulfills a single unit in each of the following BU Hub areas: Social Inquiry  II, Global Citizenship and Intercultural Literacy, Critical Thinking."""
SSI,SOC-II,102,"b'Mar,Fam,Gen'",b'This course description is currently under construction.'
SSI,SOC-II,102,b'Reforming the U.S. Health Care System',"b'In this seminar, students explore the U.S. health care system and those of  six other nations, analyzing policy challenges through team projects that  evaluate evidence-based reform strategies, and take into account economic,  social, political, managerial, ethical, legal, and regulatory factors. This  course fulfills a single unit in the following BU Hub area(s): Social  Inquiry II, Global Citizenship and Intercultural Literacy, Research and  Information Literacy.'"
