international-relations,550,European Integration,"b'n. Investigates  who is in charge and who matters in policymaking and politics. Examines a wide range of EU policies,  including economics, security, and trade, and their impact on EU member-states.'"
international-relations,551,"Social Europe: Identity, Citizenship, and the Welfare State","b'tical integration on national identities, cultures, politics, and citizenship; EU  policies affecting these  social constructions; and changes over time in the welfare state.'"
international-relations,552,Nordic Europe,"b'global politics. Addresses history from Viking Age to modern era, then turns to contemporary issues including relationship with the European  Union, security cooperation, influence in international organizations and assistance to the developing  world.'"
international-relations,556,Current Intelligence Issues,"b'nal developments in advance. Addresses issues of transnational terrorism and proliferation in additional to traditional concerns such as rogue states, counterintelligence, organized crime, regional rivals, and rising powers.'"
international-relations,557,Guerrilla Warfare and Terrorism,"b'ldwide.  Origins, ideologies, and doctrines.'"
international-relations,561,Religion and International Relations,"b""international  relations in the context of questions about the common core of modernity. Reviews scholarly and policy  literature, and case studies, in order to elucidate religion's intellectual and operational diversity in  international relations."""
international-relations,563,Public Religion and Politics Across Cultures,"b'ith the West and includes Islam in the Middle East and SE Asia, Evangelism in Latin America and Africa, Hindu nationalism, and Buddhism in China.'"
international-relations,568,U.S.-Latin American Relations,"b',  tracing its development over time and analyzing its current challenges. Each week focuses on a different  theme--including imperialism, intervention, hemispheric security, trade, immigration, and drug  trafficking--within a roughly chronological framework.'"
international-relations,571,Global Money,"b'of key monetary and financial  institutions in the global economy, with particular focus on settlement and liquidity. Examines  interface between private and public sphere, and between money view and standard economics  and finance.'"
international-relations,573,Introduction to Public International Law,"b'on environmental protection and the regulation of ocean space and resources.  The role of law in conflict and cooperation, and the quest for international security.'"
international-relations,577,Foreign Policy of the People's Republic of China,"b'egional to  a world power, and its security and economic relationships within the international system. Relationships  with the superpowers, Third World, and world economy, focusing on technology and capital transfers.'"
international-relations,579,Japan in International Politics,"b""nal behavior in the past  as a predictor of Japan's future role in international politics. Covers Japan's role in the Cold War, post-war  Asia, and the management of the global economy. Examines viability of post-Cold War U.S.-Japan relationship."""
international-relations,581,The Evolution of Strategic Intelligence,"b'the effects of intelligence on world events. Various uses of intelligence--collecting information analysis, counterintelligence, and secret operations--are explored with emphasis on the period from the Congress of Vienna to the end of the Cold War.'"
international-relations,582,Taiwan: Politics and Transformation,"b'ion, and its controversial position in international politics as a key to understanding questions of political economy, democratic transition, and East Asian security.'"
international-relations,584,The United States and Sub-Saharan Africa,"b'es, moving  beyond stereotypes and mythology. The course is organized thematically: Introduction and Contemporary  History; Security and Conflict; Economics, Trade, and Development; Human Rights and Democracy.'"
international-relations,585,Problems and Issues in Post-Mao China,"b'e  focuses on several critical issues, uses various conceptual frameworks to try to understand why  the reform process broke down, and examines prospects for the future.'"
international-relations,589,North Atlantic/European Security Issues,"b'eater European context.  Exploration of threats to security, mechanisms in place  and emerging (NATO, CSCE, CFE, WEU), and challenges posed by changes since fall 1989.'"
international-relations,590,Political Economy of Latin America,b'case studies and cross-regional comparisons to assess competing explanations. Analyzes the current  political and economic situation facing Latin America in its quest for economic growth and development.'
international-relations,592,Economic Development and International Institutions,"b'ated international institutions makes rules and affect national policy choices. Applies those lessons to  concrete policy challenges, including possibilities for institutional reform.'"
international-relations,594,Global Environmental Negotiation and Policy,"b'l environmental policies. Overviews of the international system and environmental problems; an international negotiation simulation; case studies of global agreements on ozone depletion, climate change, desertification, and biodiversity, among others.'"
international-relations,596,Globalization and Contemporary Capitalism in Advanced Industrialized Nations,"b'nance, trade, and multinationals. Examines changes in  national economic practices in Europe, Asia, and the US, and their effects on jobs, inequality, welfare, and  democracy.'"
international-relations,597,Development and Environment in Latin America,b'ental aspects of economic development in Latin America and the Caribbean (LAC) for purposes of analyzing the numerous trade and development policies that nations in LAC are currently considering.'
international-relations,599,"Science, Politics, and Climate Change","b'cy. Examines the relationships between scientific and political systems at global,  national, and local levels. Also offered as CAS GE 599.'"
