political-science,111,Introduction to American Politics,"b'utive, administrative agencies, and the judiciary. Relations  between formal institutions, parties, and interest groups. Carries social science  divisional credit in CAS. This course fulfills a single unit in the following BU  Hub area: Social Inquiry .'"
political-science,141,Introduction to Public Policy,b'apple with these questions. We also examine the question: how  do the politics of public policy affect racial and economic inequality? Carries  social science divisional credit in CAS. This course fulfills a single unit in  the following BU Hub area: Social Inquiry I.'
political-science,151,Introduction to Comparative Politics,"b'and contemporary politics in Europe, Latin America,  Africa, and Asia. Introduces the comparative method in political science and  competing theories of political development and political change. Carries  social science divisional credit in CAS. This course fulfills a single unit in  each of the following BU Hub areas: Social Inquiry I, Global Citizenship and  Intercultural Literacy.'"
political-science,171,Introduction to International Relations,"b's dominant international relations theories and their application. Investigates state system, international law and organization, transnational actors, state behavior, and globalization. Carries social science divisional credit in CAS. This course fulfills a single unit in each of the following BU Hub areas: Social Inquiry I, Global Citizenship and Intercultural Literacy.'"
political-science,191,Introduction to Political Theory,"b""istorical and contemporary events and issues illustrate  and complicate analysis of conceptions of authority, justice, liberty, and  equality. Many definitions of government, law, and rights are considered.  Carries social science divisional credit in CAS. This course fulfills a single  unit in each of the following BU Hub areas: Philosophical Inquiry and Life's  Meanings, Ethical Reasoning, Critical Thinking."""
political-science,300,Special Topics in American Politics,"b'ffered Fall 2018. Section A1: Bombs and Bombshells: Gender and Political Violence. Delve  into the world of Black  Widows and Demon Lovers. Using empirical research, case studies, and  drama, this course  separates fact from fiction to examine  gender and its intersections  between recruitment, motivations, and conditions under which women behave violently. Also  offered as CAS WS 304 A1. Section B1: War on Drugs. Examines the modern history of the  United States\' ""War on Drugs,"" exploring both the international and domestic implications of  the U.S.\'s counter narcotics policy.'"
political-science,301,Presidential Leadership,b'personality and  leadership; and comparative study of selected presidents. This course cannot be taken for credit in  addition to the course with the same title that was previously numbered CAS PO 317.'
political-science,302,Congress and Its Critics,"b'lative process;  interactions with other branches; congressional elections; campaign finance; how Congress has  changed and may  evolve in the future. This course  cannot be taken for credit in addition to the  course with the title ""The Legislative Process in America"" that was previously numbered CAS  PO 311.'"
political-science,304,The Judicial Process,"b's and judges, the structure  of the  court system, juries, and legal reasoning. Primarily intended for students who have little  or no exposure to  law courses. This course cannot be taken for credit in addition to the course  with the same title that was previously numbered CAS PO 315.'"
political-science,306,Media and Politics in the United States,"b""to do. In  particular, relates our understanding of the press's role to contemporary media developments including  technological changes, corporate media ownership, and the re-amateurization of journalism.  This course  cannot be taken for credit in addition to the course with the same title that was previously numbered CAS  PO 324."""
political-science,307,Public Opinion in American Politics,"b'public opinion in the United States. In addition to this substantive focus,  the course is intended to foster the development of two skills: critical reading  and rigorous, careful and clear writing. This course fulfills a single unit in  the following BU Hub area: Social Inquiry I.'"
political-science,309,Women and Politics,"b""issues of women's relationship to  the processes of political influence, change, and empowerment. Analysis of public policy related to women and children. This course cannot be taken for credit in addition to the course with the same title that was  previously numbered CAS PO 342."""
political-science,313,The Politics and Policy of HBO's The Wire,"b's are covered, including the war on drugs, urban  elections, bureaucracy, rational choice theory, and the decline of American  cities. Also offered as CAS AA 313 This course fulfills a single unit in each of  the following BU Hub areas: Social Inquiry II, Ethical Reasoning.'"
political-science,314,Election Campaign Practicum,b'(at least 5 hours a week)  and framing and integrating that experience with critical reading of high quality research and journalism  and investigation of current election-related data.'
political-science,320,Special Topics in Public Policy,"b'government, contemporary local public policy challenges, and methods for doing policy  research. Students collaboratively work on real local government policy projects resulting in a  report back to municipal officials.'"
political-science,321,Foundations of American Public Policy,b'istorical perspectives are used to shed light on seemingly unique American solutions to pressing social  and economic problems. This course cannot be taken for credit in addition to the course with the same  title that was previously numbered CAS PO 343.'
political-science,324,Comparative Public Policy,"b'societies in such areas as health training, unemployment, poverty, and budget.  Explores why countries develop different solutions to policy needs, and evaluates the strengths and weaknesses of various national approaches. This course cannot be taken for credit in addition to the course with the same title that was previously numbered CAS  PO 341.'"
political-science,325,Campaigns and Elections Around the World,"b'ampaigns over   time; role of international political consultants; influence of party systems, electoral systems, campaign   finance regulation, vote buying, and mass media; campaign effects on voting behavior and public opinion.  This course cannot be taken for credit in addition to the course with the same title that was previously  numbered CAS PO 302.'"
political-science,327,Non-State Actors in International Relations,"b'ctors include subnational governments, international organizations, multinational corporations,   non-governmental organizations, religious groups, violent groups, for-profit security firms, social  movements, and grassroots organizations. This course cannot be taken for credit in addition to the course  with the same title that was previously numbered CAS PO 333.'"
political-science,330,Special Topics in Comparative Politics,"b'emocracy in the Middle East: Israel as a Case for Comparative Analysis. Examines how  Israel compares to other societies, especially the US, as a democracy, focusing on immigration,  refugee, security, and human rights issues. May be of interest to Americanists as well as  comparativists. Also counts towards minor in Jewish Studies. Section B1: Democratic Erosion.  Trends in American and European politics have engendered fears about a turn toward  authoritarianism where it was once unthinkable. Explores the causes and consequences of  democratic erosion, helping students to put recent developments into comparative and  historical perspective.'"
political-science,341,European Politics,"b'Union, with  emphasis on  political development, institutions, major issues in contemporary politics, and the impact  of  European integration. Selective references to original and new member states of the EU.  This course  cannot be taken for credit in addition to the course with the same title that was previously numbered CAS  PO 361.'"
political-science,343,Europe and International Relations,"b'European nations, the dynamics of European integration, NATO, international migration and ethnic conflict,  and European relations with the United States, Russia, and neighboring countries. This course cannot be  taken for credit in addition to the course with the same title that was previously numbered CAS PO 382.'"
political-science,350,The Making of Asia,"b'ment  in China, Japan, Korea, as well as the countries of Southeast Asia. Also examines the domestic  and international impacts of growing social-economic ties, as well as the complex security  challenges among Asian states. This course cannot be taken for credit in addition to the course  titled ""The Pacific Challenge"" that was previously numbered CAS PO 350 and CAS PO 365.'"
political-science,351,China: from Revolution to Reform,"b""inese  revolution in 1949 and the cause of subsequent inauguration of reform in the late 1970s. Analyzes the  tensions that brought about the 1989 upheaval in Tiananmen Square, as well as the implications of China's  emergence as an economic power. This course cannot be taken for credit in addition to the course with the  same title that was previously numbered CAS PO 369."""
political-science,352,Rise of China,"b""ince the late nineteenth  century, with emphasis on the period since 1949. Examines three questions: In what ways is China rising?  How did it happen? What are the impacts of China's rise on the U.S. and the global system? This course  cannot be taken for credit in addition to the course with the same title that was previously numbered CAS PO 374."""
political-science,355,International Relations of South Asia,"b'Pakistan, Afghanistan, Bangladesh, and Sri Lanka inter-state relations; great power interventions; power  distributions; norms; political, military, and economic conflict and cooperation. This course cannot  be  taken for credit in addition to the course with the same title that was previously numbered CAS PO 378.'"
political-science,357,Causes of War and Peace,b'y does war  happen?  This question is addressed by focusing on a variety of scholarly explanations. Theoretical  discussions are paired with an examination of historical cases.'
political-science,358,Issues in Contemporary Politics,"b'national levels. Explores the bureaucracies, military services, and government officials  responsible for creating and maintaining nuclear weapons and energy. Also offered as CAS HI  335 and CAS IR 315.'"
political-science,360,Introduction to Latin American Politics and International Relations,"b'Focuses on the distinctive Latin American political experience and alternative  explanation for it, including colonization, the international economy, and human and material resource  capacity and utilization. This course cannot be taken for credit in addition to the course with the same title  that was previously numbered CAS PO 367.'"
political-science,368,Introduction to Middle East Politics,b'e  East since World War I. Part 1 examines state formation and competing explanations for authoritarianism.  Part 2 analyzes social movements ranging from Islamist groups to mass mobilization.'
political-science,373,African Politics Today,"b'oday. Core course  debates revolve around recent trends in African economic growth, democratic governance, and armed  conflict, in addition to several other issues of contemporary concern.'"
political-science,376,Understanding Modern North Africa,"b'states of Morocco, Tunisia, Algeria, and Libya as they struggle to gain independence from colonial  domination and to consolidate viable, secure, and legitimate states and prosperous national communities.  This course cannot be taken for credit in addition to the course with the same title that was previously  numbered CAS PO 383.'"
political-science,377,Africa in International Politics,"b""mes   include the politics of post-independence international alignments, the external causes and effects of   authoritarian rule, and Africa's role in the global political economy. This course cannot be taken for credit  in addition to the course with the same title that was previously numbered CAS PO 390."""
political-science,378,International Human Rights: Applying Human Rights in Africa,"b'anizations, drawing especially on African cases such as Congo, Zimbabwe, and Sudan.   Topics include universality vs. cultural relativism, individual vs. group rights, and issues in human rights   enforcement. This course cannot be taken for credit in addition to the course with the same title that was  previously numbered CAS PO 587.'"
political-science,379,Religion and Politics,"b""beliefs.  Covers issues such as religion's relationship to violence and terrorism, democracy and human  rights, group identity, gender and sexuality, and modernity and secularism. Also offered as CAS  IR 337 and CAS RN 379."""
political-science,380,Special Topics: International Relations in Political Science,"b'is interdisciplinary course explores how we understand  international conflicts including: how they develop, managed and their dynamics. Conflicts  examined include: Northern Ireland, South Africa, Liberia, and Israel, and Palestine. Culminates  in a comprehensive, multiday conflict resolution simulation. Section B1: American Foreign Policy  in Crisis. Examines US foreign policy decision making in the context of crisis. These include  war, cybersecurity, breaches, and election interference.'"
political-science,381,History of American Foreign Relations since 1898,"b'ional systems; emphasis on the effect of  these systems and the impact of America on the creation and operation of  international systems. This course fulfills a single unit in the following BU  Hub area(s): Historical Consciousness, Social Inquiry II.'"
political-science,384,Global Governance and International Organization,"b'comparative case studies of  selected organizations, and an examination of present and future roles of  international organizations in selected issue areas. This course fulfills a  single unit in each of the following BU Hub areas: Social Inquiry I, Global  Citizenship and Intercultural Literacy.'"
political-science,390,Special Topics in Political Theory,"b'l freedom thematized in political theory and practice. Drawing from an eclectic mix of  genres we ask what political freedom is, how it arises, what blocks it, and how we sustain it.'"
political-science,391,Classical to Early Modern Political Theory,"b'and reason; qualifications of leadership; aims and means of civic education; and  conceptions of law (man-made, natural, divine). Texts by Aristotle, Augustine, Aquinas,  Machiavelli. Meets with CAS PH 453.'"
political-science,392,Modern Political Theory,"b'tzsche. Classes  are generally a combination of lecture and discussion but also include formal debates, guest lectures, and  films.'"
political-science,393,The European Enlightenment ,"b'olution.   Readings draw on both eighteenth-century sources (including Voltaire, Diderot, Condorcet, Lessing, Smith,  and Hume) and recent work by historians. Also offered as CAS HI 215. This course cannot be taken for  credit in addition to the course with the same title that was previously numbered CAS PO 395.'"
political-science,394,Catastrophe & Memory,"b'y. Goal is to understand how events that seem to defy  comprehension are represented in works of art and given a place in the  memory of a culture. This course fulfills a single unit in each of the  following BU Hub areas: Aesthetic Exploration, Historical Consciousness,  Research and Information Literacy.'"
political-science,396,Philosophy of Gender and Sexuality,b'or are they social constructions? How are they related to love and desire? Also offered  as CAS PH 256 and CAS WS 396.'
political-science,400,Washingtn Intrn,b''
political-science,401,Internship in Politics,b''
political-science,403,Internship in Comparative Law,b''
political-science,405,Internship in International Organizations,b''
political-science,408,Higher Education and American Political Development,b'and state and critical problems in the larger U.S. context.'
political-science,409,The Political Psychology of Group-Based Politics,"b'ogy as it informs the dynamics of group-based politics, including especially race,   gender, class, and political party affiliation. Also offered as CAS PS 512.'"
political-science,458,Immigration and Development in Asia,"b""India, and South Korea. Cases examined include the rise of manufacturing prowess in China, India's  software industry, and Korea's corporate competitiveness in the world."""
political-science,497,Crime and Punishment: Philosophical Perspectives,"b',  utilitarian, and retributivist justifications of punishment; exculpating circumstances; the death penalty; and  the relationship between law and politics. Also offered as CAS PH 458.'"
political-science,500,The Politics of Education,b'al educational  policies and research. This course cannot be taken for credit in addition to the course with the same title  that was previously numbered CAS PO 548.'
political-science,501,Formal Political Theory,"b'with calculus and microeconomics is helpful, but not required.</span><br/>\n                \t\t\tA course on formal theory, covering decision theory, game theory, and social choice theory. Topics include  spatial models, electoral competition, bargaining, deterrence, and signaling models.'"
political-science,502,Political Analysis: A Primer,"b'a variety of   social science applications, as well as data analysis, data visualization and statistical software.'"
political-science,503,The U.S. in the Middle East,"b""of the United  States' association with the Middle East: American commercial, economic, political, military, and  humanitarian interests in the area and their interaction. This course cannot be taken for credit in  addition to the course with the same title that was previously numbered CAS PO 570."""
political-science,504,"Public Policy Analysis: Issues, Concepts, and Tools","b'An  analysis of several controversial public policies (e.g., regulating the economy, immigration, health care  reform) which may vary from year to year. This course cannot be taken for credit in addition to the course  with the same title that was previously numbered CAS PO 641.'"
political-science,505,Readings in American Politics,"b""erican Justice. Are Supreme Court justices engaged in  political decision making? Do judges'  personal biographies affect decisions? Can juries find  truth at trial? Should prosecutors be  elected? This seminar considers controversial topics  surrounding the American justice system  through a scientific lens. Topic for Spring 2019: Women in Government: In the United States,  about 20% of elected officeholders are women. So what? Addresses the causes and  consequences of the gender gap in political leadership. We examine legislators, executives,  bureaucrats, and judges to discern the role gender plays in recruitment, campaigning, and  governance in America."""
political-science,507,Development of American Constitutional Law,b'me Court.  The course is drawn entirely from decisions of the U.S. Supreme Court and the principal theme is the  development of national constitutions and power. This course cannot be taken for credit in addition to the  course with the same title that was previously numbered CAS PO 513.'
political-science,508,The Judiciary and Civil Liberties,b'and  the constitutional protection of racial minorities. Supreme Court decision-making processes and modes of  compliance with its decisions are also considered. This course cannot be taken for credit in addition to the  course with the same title that was previously numbered CAS PO 514.'
political-science,509,Legislative Behavior ,"b'between members to being a cockpit for partisan conflict? How do American legislators  compare to legislators in other advanced democracies like Canada, Germany, and the UK?'"
political-science,511,American Electoral Behavior,"b'voting in U.S.  presidential elections. Topics include partisanship, ideology, voter turnout, political  participation, campaign organization and strategy, and the effects of campaigns on voters.'"
political-science,513,"Interest Groups, Public Opinion, and the Policy Process","b'ention is paid to the role of the media, of lobbying, of litigation, and of  the electoral process.  This course cannot be taken for credit in addition to the course with the  same title that was previously numbered CAS PO 544.'"
political-science,515,American Politics and Use of Force,"b'xplores how  Congress, courts, interest groups, media, and public opinion define Presidential action in times of crisis, as  well as the kinds of crises that evoke action. This course cannot be taken for credit in addition to the course with the same title that was previously numbered CAS PO 518.'"
political-science,516,Gender and Politics,"b""primarily in the United  States. Considers inequalities based on gender and sexuality, women's changing political,  gender- and sexuality-based political action and social movements. Also offered as CAS WS  516."""
political-science,517,Urban Politics and Policy,"b'include   deindustrialization, white flight, neighborhood effects, housing policy, schools, regionalism, and factors   that constrain policy-making capacities.  Also offered as CAS AA 517.'"
political-science,519,Inequality and American Politics,b'es the  role of income inequality in shaping American politics and policy.'
political-science,520,Readings in Public Policy,"b'Combines classic and recent political science research with current events to explore threats to  US national security, the tools available to U.S. policymakers to combat these threats, and the  domestic and bureaucratic politics of the U.S. defense establishment.'"
political-science,528,Seminar: The Political Economy of Advanced Industrialized Societies,"b'current challenges to state sovereignty, such as globalization and immigration; and examines  how nations from different welfare state regimes are coping with these threats to the nation state. This  course cannot be taken for credit in addition to the course with the same title that was previously  numbered CAS PO 621.'"
political-science,529,Globalization and Contemporary Capitalism in Advanced Industrialized Nations,"b'ance, trade, and multinationals. Examines changes in national  economic practices in Europe, Asia, and the US, and their effects on jobs, inequality, welfare, and  democracy. This course cannot be taken for credit  in addition to the course with the same title that was  previously numbered CAS PO 538.'"
political-science,530,Readings in Comparative Politics,"b'- party rule, the vast majority of African countries now hold multiparty elections to select    leaders. Explores strategies African politicians employ for winning and maintaining power and    how African voters decide for whom to vote.'"
political-science,533,Globalization of Nationalism,"b'olitical, social, and economic implications. Emphasis is on nationalism\'s spread into territories  in Asia, specifically China, and under the cover of religion (e.g., ISIL) and secular social  movements (e.g., ""June Days"" in Brazil).'"
political-science,535,European Integration,"b'n. Investigates  who is in charge and who matters in policymaking and politics. Examines a wide range of EU policies,  including economics, security, and trade, and their impact on EU member-states. This course cannot be  taken for credit in addition to the course with the same title that was previously numbered CAS PO 525.'"
political-science,536,"Social Europe: Identity, Citizenship, and the Welfare State","b'ical integration on national identities, cultures, politics, and citizenship; EU  policies affecting these social constructions; and changes over time in the welfare state. This  course cannot be taken for credit in addition to the course with the same title that was previously  numbered CAS PO 528.'"
political-science,537,The British Political System,"b'tics,  ranging from identity politics to the evolution of bureaucracies, parties, and voting behavior. Examines the  general failure to export the Westminster model in the aftermath of colonialism.'"
political-science,542,Immigration: Politics and Policy,"b'ies. This course explores the politics, economics, and social consequences of immigration policies across a number of countries, including European states and the United States.'"
political-science,544,Nordic Europe,"b'global politics. Addresses history from   Viking Age to modern era, then turns to contemporary issues including relationship with the European  Union, security cooperation, influence in international organizations and assistance to the developing  world. This course cannot be taken for credit in addition to the course with the same title that was  previously numbered CAS PO 529.'"
political-science,548,Political Economy of China,"b""progresses  and limitations? How is China's political-economic development influencing the global system?  Discussions are conducted in a comparative perspective. Countries of reference include Japan and  India. This course cannot be taken for credit in addition to the course with the same title that was  previously numbered CAS PO 527."""
