political-science,549,Problems and Issues in Post-Mao China,"b'se  focuses on several critical issues, uses various conceptual frameworks to try to understand why  the reform process broke down and examines prospects for the future. This course cannot be  taken for credit in addition to the course with the same title that was previously numbered CAS PO  558.'"
political-science,552,Japan in International Politics,"b""nal behavior in the past  as a predictor of Japan's future role in international politics. Covers Japan's role in the Cold War, post-war  Asia, and the management of the global economy. Examines viability of the post-Cold War U.S.-Japan  relationship. This course cannot be taken for credit in addition to the course with the same title that was  previously numbered CAS PO 579."""
political-science,553,Taiwan: Politics and Transformation ,"b'n, and its controversial position in international politics as a key to understanding questions  of political economy, democratic transition, and East Asian security. This course cannot be taken for credit  in addition to the course with the same title that was previously numbered CAS PO 582.'"
political-science,554,Conflict and Cooperation in Asia,"b'rounding issues ranging from water resources and health to borders and war. Analyzes how  such issues contribute to instability in the region, as well as methods of cooperation. This course  cannot be taken for credit in addition to the course with the same title that was previously  numbered CAS PO 530.'"
political-science,558,War and Society in the Modern Age,b'focusing on segments of the armed forces). How states fight wars and how changes in warfare affect the  relationship between state and society.'
political-science,561,Latin American Political Parties,"b'co, Peru,  and Venezuela. Historical origins and labor incorporation. Populist, working-class, and hegemonic parties.  Market reform and party system transformation or collapse. Ethnic parties, clientelism, rise of a new Left.  This course cannot be taken for credit in addition to the course with the same title that was previously  numbered CAS PO 509.'"
political-science,562,Political Economy of Latin America,b'case  studies and cross-regional comparisons to assess competing explanations. Analyzes the current political  and economic situation facing Latin America in its quest for economic growth and development. This  course cannot be taken for credit in addition to the course with the same title that was previously numbered CAS PO 550.'
political-science,565,U.S.-Latin American Relations,"b'ip,  tracing its development over time and analyzing its current challenges. Each week focuses on a different  theme--including imperialism, intervention, hemispheric security, trade, immigration, and drug  trafficking--within a roughly chronological framework. This course cannot be taken for credit in addition  to the course with the same title that was previously numbered CAS PO 568.'"
political-science,566,Conflict and Conflict Resolution in Latin America,"b'America, both internal and regional, examining their causes and consequences, and the most important  factors that explain how they were resolved or why they persist. This course cannot be taken for credit in  addition to the course with the same title that was previously numbered CAS PO 411.'"
political-science,571,Government and Politics of Contemporary Africa,"b'roblems of political order, ambiguities of independence. Case studies of individual countries  selected for additional emphasis on specific issues and problems of the developing countries. This course  cannot be taken for credit in addition to the course with the same title that was previously numbered CAS  PO 565.'"
political-science,572,Political Systems of Southern Africa,"b'n the problems of governmental stability, the prospects for integration and disintegration, the  range of responses to interracial tensions, and their international repercussions. This course  cannot be taken for credit in addition to the course with the same title that was previously  numbered CAS PO 566.'"
political-science,576,The Foreign Policy of the People's Republic of China,"b'nal to  a world power, and its security and economic relationships within the international system. Relationships  with the superpowers, Third World, and world economy, focusing on technology and capital transfers. This  course cannot be taken for credit in addition to the course with the same title that was previously  numbered CAS PO 578.'"
political-science,578,The United States as a World Power,"b'gh the course is  primarily concerned with twentieth-century U.S. foreign policy, attention is also given to eighteenth- and  nineteenth-century issues. This course cannot be taken for credit in addition to the course with the same  title that was previously numbered CAS PO 674.'"
political-science,580,Readings in International Relations in Political Science,b''
political-science,582,North Atlantic/European Security Issues,"b'ater European context. Exploration of threats to security, mechanisms in place  and emerging (NATO, CSCE, CFE, WEU), and challenges posed by changes since fall 1989. This  course cannot be taken for credit in addition to the course with the same title that was previously  numbered CAS PO 531.'"
political-science,583,Gender and War,"b'nclude gender biases in  international relations theories, female and male roles in war, and rape as an instrument of warfare. Also  assesses roles of women as leaders, actors, and objects of foreign policy.'"
political-science,586,Science Fiction and World Politics,"b'present  international relations, and those interested in imagining and making alternative political futures. Topics  include causes of war, distribution of wealth and power, and consequences of nationalism. This course  cannot be taken for credit in addition to the course with the same title that was previously numbered CAS  PO 670.'"
political-science,589,Religion and International Relations,"b""international  relations in the context of questions about the common core of modernity. Reviews scholarly and policy  literature, and case studies, in order to elucidate religion's intellectual and operational diversity in  international relations."""
political-science,590,Readings in Political Theory,"b'A1:: Great Speeches. Concerns the theory and practice of great  speeches. Students read  classical works about oratory and the art of speech writing, deliver  famous speeches in history,  and write and deliver their own speeches. Especially recommended  for those fearful of public- speaking. Section B1: The Politics of Love. This political theory course asks, through reading  authors like Hannah Arendt, Audre Lorde, and Lauren Berlant, whether love is a promising  political resource that evokes our common humanity, or a dangerous political fantasy that  reinforces heteronormativity and racial inequality.'"
political-science,591,Seminar in Political Philosophy,"b'political  philosophy. Topic for Fall 2016: Political Ideas and the Arts. Students develop their own  reading list of works by a political philosopher; research art in all media--paintings, songs,  poems, novels, and movies--illustrative of the concepts encountered; and write and present  papers integrating the political ideas and art discovered. This course cannot be taken for  credit in addition to the course by the same title that was previously numbered CAS PO 691.'"
political-science,592,Enlightenment and Its Critics,"b'have  been taken up by twentieth-century thinkers such as Heidegger, Horkheimer, Adorno, Gadamer, and  Foucault; discusses recent defenses of Enlightenment ideals of reason, critique, and autonomy by  Habermas and others.  This course cannot be taken for credit in addition to the course with the same title  that was previously numbered CAS PO 693.'"
political-science,594,Historical Traditions of Feminist Theory,"b'he late-20th  century feminist movement, to understand the richness of that history and the varieties of approaches  theorists took in understanding and resisting gender-based oppression. Also offered as CAS WS 594.'"
