womens-studies,101,Gender and Sexuality I: An Interdisciplinary Introduction ,"b""he origins, diversity, and expression of gendered and sexed   individuals. Topics include the evolutionary origin of sexes; evolution, development, and social   construction of sex, gender, and sexuality; sexual difference, similarities and diversity in bodies,   brains, and behavior. This interdisciplinary introduction is the required year-long gateway   sequence for the minor in Women's, Gender, and Sexuality Studies. Students who complete  both halves of the two-semester sequence WS 101/102 receive divisional studies credit for two  courses, from two different divisions: Natural Science (without lab), Social  Science, and/or  Humanities. Neither WS 101 nor WS 102 alone carries divisional studies credit. This course  fulfills a single unit in each of the following BU Hub areas: Philosophical Inquiry and Life's  Meanings, Scientific Inquiry I, Critical Thinking."""
womens-studies,102,Gender and Sexuality II: An Interdisciplinary Introduction,"b'oaches from the natural sciences, social sciences, and  humanities, with a focus on society and social relationships. We examine questions relating to  violence, inequality, and family formation through an interdisciplinary gender lens. Students  who complete both halves of the two-semester sequence WS 101/102 receive divisional studies  credit for two courses, from two different divisions: Natural Science (without lab), Social  Science, and/or Humanities. Neither WS 101 nor WS 102 alone carries divisional studies credit.  This course fulfills a single unit in each of the following BU Hub areas: Social Inquiry I, Ethical  Reasoning, Critical Thinking.'"
womens-studies,200,Thinking Queerly: An Introduction to LGBTQ Studies,"b'interdisciplinary (and often, competing) theories and research.  Students gain skills in digital/multimedia  expression through the development of a  collaborative LGBTQ online magazine. This course fulfills a single unit in each of the following  BU Hub areas: Individual in Community, Digital/Multimedia Expression.'"
womens-studies,213,Sexism in the Twenty-First Century,"b'hances, with particular attention to how race, class, and sexuality intersect with gender to  shape social inequalities. This course fulfills a single unit in each of the following BU Hub areas:  Social Inquiry I, Global Citizenship and Intercultural Literacy.'"
womens-studies,233,The Evolutionary Biology of Human Variation,"b'theory, and genetics and considers how research in these fields informs some of our most  culturally-engaged identities: race, sex, gender, sexuality, and body type. Carries natural sciences  divisional credit (without lab) in CAS. Also offered as CAS AN 233.'"
womens-studies,240,Sexuality and Social Life,"b'f  sexuality, with a focus on the social and cultural institutions that shape sexuality in the  contemporary U.S. Carries social science divisional credit in CAS. Also offered as CAS SO 240.'"
womens-studies,241,Sociology of Gender,"b'ic, political, social,    and cultural forces that shape gender relations. Examines gender as a social structure that patterns    institutional inequalities and everyday interactions on society. Carries social sciences divisional credit in   CAS. Also offered as CAS SO 241.'"
womens-studies,263,The Behavioral Biology of Women,"b""aspects of women's lives from puberty through pregnancy, birth, lactation,  menopause, and aging. Examples are drawn from traditional and industrialized societies, and  data from nonhuman primates are considered. Also offered as CAS AN 263."""
womens-studies,297,African American Women's History,"b'ritical role in shaping the meaning of race, gender, and sexuality during slavery, Jim Crow,  and the civil rights era. Also offered as CAS AA 297 and CAS HI 297.'"
womens-studies,302,WGS Topics in the Social Sciences,"b'or credit as topics change. Topic for Fall 2018: Feminist Theories.  Survey of feminist  theories and development of strands of feminist ideas in the academy, popular culture, social  movements, and politics. Explores the intersections of gender, race, class, sexuality, and other  dimensions of identity, and pathways toward social change and empowerment.'"
womens-studies,303,WGS Topics in Film and Media,"b'or credit as topics change. May be repeated for credit if topic is different. Two topics are  offered Spring 2018. Section A1: Jane Campion: A Girl\'s Own Story. In-depth study of Jane  Campion, whose prolific output has largely resisted any attempt to represent ""the"" woman\'s  voice -- a pressure Campion has had to face due to being a rare female director working in a  male-dominated industry. Also offered as CAS CI 340 A1. Section B1: Middle East Gender and  Globalization. Exploration of the intersection of gender, sexuality, and globalization in Middle  Eastern films. Analysis and interrogation of films\' contributions to the construction of gender  and sexual norms in the late 20th and early 21st centuries. Also offered as CAS CI 390 C1 and  CAS XL 382 A1.'"
womens-studies,304,WGS Topics in Global and Transnational Studies,"b'for credit as topics change. Topics vary. May be taken multiple times for credit    providing the topic is different. Two topics are offered Fall 2018. Section A1: Bombs and  Bombshells: Gender and Political Violence. Delve into the world of Black Widows and Demon  Lovers. Using empirical research, case studies, and drama, this course separates fact from  fiction to examine gender and its  intersections between  recruitment, motivations, and  conditions under which women behave  violently. Also offered as CAS PO 300 A1. Section B1:  Change and Continuity on the Silk Road. Focused on the Central Asian portion of the Silk Road  from the border of China to Istanbul students explore written and visual texts to understand  shifts in gender dynamics in societies caught between Islam, communism, and globalization.  Also offered as CAS XL 381 A1.'"
womens-studies,305,"Topics in Women's, Gender, & Sexuality Studies","b""veys major texts and arguments in queer theory from Butler's Gender Trouble   to contemporary discussions of cisnormativity, homonationalism, affect, pinkwashing, crip   theory, and queer-of-color critique. Explores different uses of queer theory in legal debates,   literary analysis, and cultural criticism. Also offered as CAS XL 470 A1. Section B1:  Superwomen, Vampires, and Cyborgs: Bodily  Transformations and Social Change. Examines  popular figures that cross gender, sexual, racial,  and human boundaries, challenging our ideas  about these social categories. Are these figures  metaphors for feminism, gay rights, racial  equality? Readings in sociology and psychology,  science fiction, and other pop genres,  including movies and television. Section C1: Sex, Art, and  the Sacred in Modern America.  Traces heated debates over sex, art, and religion to reveal  competing genealogies of the  sacred and profane in the modern US. Looks at feminist and  queer visual and performance art,  literature, and memoir in the context of culture wars  conservatism. Section D1: Queer Global  Novel. Explores the relationship between gender,  sexuality, and globalization in contemporary  novels by Patricia Powell, Roxane Gay, Qui Miaojin,  Monique Truong, and others. Theoretical  readings by Gayle Rubin, Jeffrey Weeks, Judith Butler,  Jack Halberstam, and others."""
womens-studies,326,Arts of Gender,"b'rama, dance,  film,  and literature, and how art reflects historical constructions of gender. Topic for Spring  2017: Queer Literature and Film. An overview of same-sex attraction in literature from the  Greeks (Plato and Sappho) to the present and a study of queer identities in film from the silent  period to the 21st century, both with a historical emphasis. Weekly screenings. Also offered as  CAS CI 390 B1 and CAS EN 326 A1.'"
womens-studies,328,Cultural Constructions of Motherhood,"b'counts as both ""good"" and ""bad"" mothering--is currently understood. Three key questions will drive our exploration: How does culture shape mothering practices? How do mothering practices shape culture? How do race, economic class, educational attainment, and sexual orientation impact how motherhood is constructed? Discussions of related topics such as fathering, maternal body image, celebrity profiles, mother blame, parenting roles, and the economic costs of motherhood will be explored. This course fulfills a single unit in each of the following BU Hub areas: Social Inquiry I, Individual in Community, Critical Thinking.'"
womens-studies,330,Transforming Life: Anthropology of New Medical Technologies,"b'e.g., about gender, person    hood, kinship, and community, using case studies of new reproductive    technologies in Asia, the Middle East, and North America. This course    fulfills a single unit in each of the following BU Hub areas: Global    Citizenship and Intercultural Literacy, Ethical Reasoning.'"
womens-studies,335,"Sociology of Race, Class & Gender","b'tity, and  experience. Draws heavily from feminist theories in both sociology and history in order to  analyze how these intersections can be applied to understanding social problems and  structures. Also offered as CAS AA 335 and CAS SO 335.'"
womens-studies,340,"Women, Race, and Gender in Mass Media","b'omen, femininity, and race; their relation to women\'s lived experience; and the place of ""feminine"" values in contemporary culture.'"
womens-studies,346,Women and Film,"b'shaped by cultural  perceptions of women. Readings provide background for interpretation of films ranging from screwball  comedy to film noir, ""women\'s films,"" and films by women directors. Also offered as CAS CI 373.'"
womens-studies,350,Women and Politics,"b'esses of political influence, change, and empowerment. Analysis of public policy related to women and children. Also   offered as CAS PO 309.'"
womens-studies,352,American Masculinities,"b'ys culture reproduces/articulates masculinities, particularly with regard to race and class; how masculine identities are expressed; male privilege; alternative masculinities; and what is at stake in negotiating contemporary masculinities.  Also offered as CAS SO 352.'"
womens-studies,356,Women and Comedy in America,"b'y and  transmute aggression into humor; what women find funny; and how women use the power of humor for  survival, resistance, subversion, and truth-telling.'"
womens-studies,360,Global Feminism: Race and Gender in International Perspectives,"b""women and the global economy, health care, reproduction, the dynamics of sex  industries, violence against women, international women's movements, and political/institutional change."""
womens-studies,375,Growing Up Kor,b''
womens-studies,393,Technoculture and Horizons of Gender and Race,"b'der, race, and sexuality. Through critical reading, writing, and hands-on digital technology  use, students consider how race, sexuality, and gender live in virtual worlds. Also offered as  CAS EN 393.'"
womens-studies,396,Philosophy of Gender and Sexuality,b'r are they social constructions? How are they related to love and desire? Also offered as CAS PH 256 and CAS PO 396.'
womens-studies,403,Seminar: Gender Stratification,"b'dered  inequalities in employment, the family, dating markets, media representation, etc., with a  special emphasis on how race, class, sexuality, and disability mediate the process. Also offered  as CAS SO 403.'"
womens-studies,420,Queer Theory,"b'o  contemporary discussions of cisnormativity, homonationalism, affect, pinkwashing, crip theory,  and queer-of-color critique. Explores different uses of queer theory in legal debates, literary  analysis, and cultural criticism.'"
womens-studies,430,Global Maternal & Child Health,"b'y life  influences on later life health, maternity care practices worldwide, and the role of both human  evolutionary history and sociopolitical structures in shaping health outcomes for women and  children.'"
womens-studies,434,Monarchy in Modern Britain,b'ics of the    court intersected with the politics of the people. Particular consideration is given to how monarchy has   survived as an institution. Also offered as CAS HI 434.'
womens-studies,450,"Internships: Women, Gender, and Social Change","b'h local   internships and weekly discussions related to class, race, sexuality, women and gender.'"
womens-studies,451,Fashion as History,"b'ments. Explores what  clothing can tell us about key developments in the modern period relating to trade and commerce, empire,  gender, class, industry, revolution, nation-building, identity politics, and globalization. Also offered as CAS  HI 451.'"
womens-studies,452,Contemporary Debates in Sexualities Research,"b'as both a social construct and an institution. Students consider how sexualities operate across  social contexts, their effects on systems of inequalities, and their intersections with race, class,  and gender. Also offered as CAS SO 452.'"
womens-studies,454,Sexuality and Religion in the U.S.,"b'sexual desire, identity, ritual, and regulation. Possible topics include religious and sexual  freedom, plural marriage, the Sexual Revolution, reproductive justice, sex and secularism, and  LGBTQ rights. Also offered as CAS RN 454.'"
womens-studies,516,Gender and Politics,"b""primarily in the United  States. Considers inequalities based on gender and sexuality, women's changing political,  gender- and sexuality-based political action and social movements. Also offered as CAS PO  516."""
womens-studies,558,"Human Sex Differences: Behavior, Biology, and Ecology","b'es in human behavior, physiology, and cognition from developmental, mechanistic,  and phylogenetic perspectives. Topics include sex differences in aggression, mate choice,  parenting, affiliation, and cognition. Also offered as CAS AN 558.'"
womens-studies,594,Historical Traditions of Feminist Theory,"b'he late-20th  century feminist movement, to understand the richness of that history and the varieties of approaches  theorists took in understanding and resisting gender-based oppression. Also offered as CAS PO 594.'"
